{
  "hop": "8_to_9",
  "laravel_from": "8.x",
  "laravel_to": "9.x",
  "php_minimum": "8.0",
  "last_curated": "2026-03-21",
  "breaking_changes": [
    {
      "id": "l9_model_dates_removed",
      "severity": "high",
      "category": "eloquent",
      "title": "Model $dates property removed",
      "description": "The $dates property on Eloquent models has been removed in Laravel 9. You must use the $casts property with 'datetime' cast instead. Existing $dates entries must be migrated to $casts.",
      "rector_rule": "RectorLaravel\\Rector\\Class_\\UnifyModelDatesWithCastsRector",
      "automated": true,
      "affects_lumen": true,
      "manual_review_required": false,
      "detection_pattern": "protected \\$dates",
      "migration_example": {
        "before": "protected $dates = ['deleted_at', 'published_at'];",
        "after": "protected $casts = ['deleted_at' => 'datetime', 'published_at' => 'datetime'];"
      },
      "official_doc_anchor": "https://laravel.com/docs/9.x/upgrade#dates-property"
    },
    {
      "id": "l9_castable_interface_change",
      "severity": "high",
      "category": "eloquent",
      "title": "Custom cast classes implementing Castable must return class string",
      "description": "The Castable interface's castUsing() method now receives an array of $arguments instead of variadic arguments. Classes implementing Castable::castUsing() must update their signature.",
      "rector_rule": null,
      "automated": false,
      "affects_lumen": true,
      "manual_review_required": true,
      "detection_pattern": "implements Castable",
      "migration_example": {
        "before": "public static function castUsing(...$arguments) { return MyCast::class; }",
        "after": "public static function castUsing(array $arguments): string { return MyCast::class; }"
      },
      "official_doc_anchor": "https://laravel.com/docs/9.x/upgrade#custom-casts-and-null"
    },
    {
      "id": "l9_model_new_collection_signature",
      "severity": "medium",
      "category": "eloquent",
      "title": "Model::newCollection() signature changed — array argument required",
      "description": "The newCollection() method on Eloquent models now requires an explicit array type hint on its parameter. Any custom model overriding this method must add the type hint.",
      "rector_rule": null,
      "automated": false,
      "affects_lumen": true,
      "manual_review_required": false,
      "detection_pattern": "function newCollection",
      "migration_example": {
        "before": "public function newCollection($models = []) { return new CustomCollection($models); }",
        "after": "public function newCollection(array $models = []): \\Illuminate\\Database\\Eloquent\\Collection { return new CustomCollection($models); }"
      },
      "official_doc_anchor": "https://laravel.com/docs/9.x/upgrade#custom-eloquent-model-collection"
    },
    {
      "id": "l9_authenticate_with_basic_auth_constructor",
      "severity": "medium",
      "category": "middleware",
      "title": "AuthenticateWithBasicAuth middleware constructor signature changed",
      "description": "The AuthenticateWithBasicAuth middleware constructor now receives a Guard instance as its first argument rather than resolving it from the container implicitly. Applications extending this middleware must update their constructors.",
      "rector_rule": null,
      "automated": false,
      "affects_lumen": false,
      "manual_review_required": true,
      "detection_pattern": "AuthenticateWithBasicAuth",
      "migration_example": {
        "before": "public function __construct() { $this->guard = app('auth'); }",
        "after": "public function __construct(\\Illuminate\\Contracts\\Auth\\Factory $auth) { $this->auth = $auth; }"
      },
      "official_doc_anchor": "https://laravel.com/docs/9.x/upgrade#the-authenticate-with-basic-auth-middleware"
    },
    {
      "id": "l9_gate_after_false_ignored",
      "severity": "high",
      "category": "middleware",
      "title": "Gate::after() no longer overrides explicit denials",
      "description": "In Laravel 9, Gate::after() callbacks that return false no longer override an explicit false returned by a Gate::before() or policy. Previously a false from an after() callback could override policy decisions; this was a bug. Applications relying on after() returning false to deny access must migrate to before() or policies.",
      "rector_rule": null,
      "automated": false,
      "affects_lumen": false,
      "manual_review_required": true,
      "detection_pattern": "Gate::after",
      "migration_example": {
        "before": "Gate::after(function ($user, $ability) { return false; // was incorrectly blocking });",
        "after": "Gate::before(function ($user, $ability) { return false; // use before() to explicitly deny });"
      },
      "official_doc_anchor": "https://laravel.com/docs/9.x/upgrade#the-gate-after-method"
    },
    {
      "id": "l9_kernel_bootstrappers_removed",
      "severity": "high",
      "category": "config",
      "title": "Console Kernel $bootstrappers property removed",
      "description": "The protected $bootstrappers property on Illuminate\\Foundation\\Console\\Kernel has been removed. Applications that overrode $bootstrappers to customise bootstrap classes must switch to overriding the bootstrappers() method.",
      "rector_rule": null,
      "automated": false,
      "affects_lumen": false,
      "manual_review_required": true,
      "detection_pattern": "\\$bootstrappers",
      "migration_example": {
        "before": "protected $bootstrappers = [\\App\\Bootstrap\\RegisterFacades::class];",
        "after": "protected function bootstrappers(): array { return [\\App\\Bootstrap\\RegisterFacades::class]; }"
      },
      "official_doc_anchor": "https://laravel.com/docs/9.x/upgrade#the-kernel-contract"
    },
    {
      "id": "l9_schedule_expression_passes_protected",
      "severity": "low",
      "category": "config",
      "title": "Schedule::expressionPasses() made protected",
      "description": "The expressionPasses() method on Illuminate\\Console\\Scheduling\\Event was changed from public to protected. External code calling this method directly will throw a fatal error.",
      "rector_rule": null,
      "automated": false,
      "affects_lumen": false,
      "manual_review_required": false,
      "detection_pattern": "->expressionPasses()",
      "migration_example": {
        "before": "$event->expressionPasses();",
        "after": "// use isDue() or check via the scheduler — direct access was never part of the public API"
      },
      "official_doc_anchor": "https://laravel.com/docs/9.x/upgrade#the-expression-passes-method"
    },
    {
      "id": "l9_connection_interface_select_signature",
      "severity": "high",
      "category": "eloquent",
      "title": "ConnectionInterface::select() signature change",
      "description": "The select() method on Illuminate\\Database\\ConnectionInterface now has an updated signature. Custom connection implementations must add the $useReadPdo parameter to their select() methods.",
      "rector_rule": null,
      "automated": false,
      "affects_lumen": true,
      "manual_review_required": true,
      "detection_pattern": "implements ConnectionInterface",
      "migration_example": {
        "before": "public function select(string $query, array $bindings = []): array",
        "after": "public function select(string $query, array $bindings = [], bool $useReadPdo = true): array"
      },
      "official_doc_anchor": "https://laravel.com/docs/9.x/upgrade#database"
    },
    {
      "id": "l9_grammar_compile_insert_get_id",
      "severity": "medium",
      "category": "eloquent",
      "title": "Grammar::compileInsertGetId() signature changed",
      "description": "The compileInsertGetId() method in database grammar classes now requires an explicit string type on the $sequence parameter. Custom grammar subclasses must add this type hint.",
      "rector_rule": null,
      "automated": false,
      "affects_lumen": false,
      "manual_review_required": false,
      "detection_pattern": "compileInsertGetId",
      "migration_example": {
        "before": "public function compileInsertGetId(Builder $query, array $values, $sequence): string",
        "after": "public function compileInsertGetId(Builder $query, array $values, ?string $sequence): string"
      },
      "official_doc_anchor": "https://laravel.com/docs/9.x/upgrade#database"
    },
    {
      "id": "l9_pdo_integer_binding_removed",
      "severity": "medium",
      "category": "eloquent",
      "title": "PDO integer binding (PDO::PARAM_INT) no longer used",
      "description": "Laravel 9 no longer uses PDO::PARAM_INT when binding integer values to queries. All values are bound as PDO::PARAM_STR. Applications that relied on database-level integer casting from PDO bindings may see behavioural differences with strict comparison in stored procedures or triggers.",
      "rector_rule": null,
      "automated": false,
      "affects_lumen": true,
      "manual_review_required": true,
      "detection_pattern": "PDO::PARAM_INT",
      "migration_example": {
        "before": "// Laravel internally used PDO::PARAM_INT for integer values",
        "after": "// All values now bound with PDO::PARAM_STR — ensure stored procs handle string-typed integers"
      },
      "official_doc_anchor": "https://laravel.com/docs/9.x/upgrade#database"
    },
    {
      "id": "l9_sqlite_minimum_version",
      "severity": "high",
      "category": "environment",
      "title": "SQLite minimum version bumped to 3.26.0",
      "description": "Laravel 9 requires SQLite 3.26.0 or higher. Environments running older SQLite versions (common on Ubuntu 18.04 / macOS High Sierra era) will fail at runtime when using SQLite databases.",
      "rector_rule": null,
      "automated": false,
      "affects_lumen": true,
      "manual_review_required": false,